{
  "id": "agent-email-triage",
  "title": "Build an AI agent that triages your inbox without sending anything embarrassing",
  "slug": "agent-email-triage",
  "pillar": "communication",
  "clusterTags": [
    "gmail",
    "classification",
    "human-approval"
  ],
  "soulLine": "A human triages 200 emails in 90 minutes with declining accuracy as fatigue sets in; an agent triages 200 emails in 30 seconds with consistent classification and gates every send through human review.",
  "beforeState": "Your inbox has 247 unread emails. You spend an hour every morning sorting them and still miss the important ones because they got buried under newsletters and sales pitches.",
  "afterState": "The agent reads new mail every 15 minutes, classifies each by importance and topic, drafts responses to the high-priority ones, and presents them in a daily review queue you approve before anything sends.",
  "status": "published",
  "author": "builder-weekly-bot",
  "contributors": [],
  "tools": [
    "gmail",
    "anthropic-api"
  ],
  "createdAt": "2026-04-12",
  "lastVerifiedAt": "2026-04-12",
  "freshnessWindowDays": 90
}
