{
  "id": "metered-billing-agent",
  "title": "Meter agent usage and bill customers in real-time without manual reconciliation",
  "slug": "metered-billing-agent",
  "pillar": "payments",
  "clusterTags": [
    "stripe",
    "metered-billing",
    "usage-tracking"
  ],
  "soulLine": "An agent meters a thousand customer API calls per second with sub-cent precision, which a manual usage report at month-end gets wrong by five to fifteen percent and creates billing disputes that erode trust.",
  "beforeState": "You charge customers a flat monthly fee but their usage varies wildly. Heavy users pay too little and you lose money. Light users pay too much and they churn. You know metered billing fixes this but the reconciliation logic terrifies you.",
  "afterState": "Every customer action emits a usage event that streams to Stripe in real-time. At the end of each billing period, Stripe generates an accurate invoice with no manual reconciliation. Heavy users pay for what they use. Light users stay because they pay only for what they need.",
  "status": "published",
  "author": "tbw-ai",
  "contributors": [],
  "tools": [
    "stripe",
    "anthropic-api"
  ],
  "createdAt": "2026-04-14",
  "lastVerifiedAt": "2026-04-14",
  "freshnessWindowDays": 90
}