{
  "id": "multi-step-workflows-with-approval",
  "title": "Build multi-step AI agent workflows with human approval at the right moments",
  "slug": "multi-step-workflows-with-approval",
  "pillar": "foundations",
  "clusterTags": [
    "orchestration",
    "human-in-the-loop",
    "state-machines"
  ],
  "soulLine": "An autonomous agent doing a 10-step task fully autonomously will eventually take a wrong path costing real money or trust; a state-machine agent with approval gates at the right steps gets the same speed with bounded risk.",
  "beforeState": "Your agent runs a 10-step workflow end-to-end. Step 7 makes a wrong call. You don't notice until step 10 produces something embarrassing or expensive.",
  "afterState": "The workflow pauses at the steps where a wrong call would be costly, presents its decision to you for approval, and only proceeds after you confirm or correct.",
  "status": "published",
  "author": "builder-weekly-bot",
  "contributors": [],
  "tools": [
    "cueapi",
    "anthropic-api"
  ],
  "createdAt": "2026-04-12",
  "lastVerifiedAt": "2026-04-12",
  "freshnessWindowDays": 90
}
