{
  "id": "retrieval-with-metadata-filters",
  "title": "Retrieve from a vector store with metadata filters and get the right chunk",
  "slug": "retrieval-with-metadata-filters",
  "pillar": "memory",
  "clusterTags": [
    "retrieval",
    "vector-stores",
    "metadata-filters"
  ],
  "soulLine": "An agent combining semantic search with metadata filters reaches into ten million chunks and returns the right one in under a hundred milliseconds, which a human searching a SQL database by hand cannot come close to matching.",
  "beforeState": "Your agent's retrieval returns ten loosely relevant chunks because pure semantic search can't tell which belong to which user or which date range.",
  "afterState": "The same retrieval with metadata filters returns one chunk, it is the right one, and the latency is identical.",
  "status": "published",
  "author": "tbw-ai",
  "contributors": [],
  "tools": [
    "qdrant",
    "anthropic-api"
  ],
  "createdAt": "2026-05-06",
  "lastVerifiedAt": "2026-05-06",
  "freshnessWindowDays": 90
}
