{
  "id": "roster-of-four-agents",
  "title": "Run a roster of four agents in a single workflow without the wheels coming off",
  "slug": "roster-of-four-agents",
  "pillar": "agent-teams",
  "clusterTags": [
    "multi-agent",
    "orchestration",
    "workflow"
  ],
  "soulLine": "An agent team with well-defined handoffs produces the same multi-step result end-to-end in one minute that a four-person human team takes a full meeting to coordinate, and the agent team doesn't need a meeting.",
  "beforeState": "You tried to chain four agents together and the output of each one contaminated the input of the next until the final agent produced garbage.",
  "afterState": "Four agents run in a defined sequence with typed handoffs, each stage produces verifiable intermediate output, and you can inspect any stage independently if the final result looks wrong.",
  "status": "published",
  "author": "tbw-ai",
  "contributors": [],
  "tools": [
    "anthropic-api",
    "inngest"
  ],
  "createdAt": "2026-04-29",
  "lastVerifiedAt": "2026-04-29",
  "freshnessWindowDays": 90
}
