{
  "id": "agent-observability-stack",
  "title": "The observability stack every production AI agent needs",
  "slug": "agent-observability-stack",
  "pillar": "foundations",
  "clusterTags": [
    "logging",
    "tracing",
    "metrics",
    "debugging"
  ],
  "soulLine": "An agent without observability is a black box; an agent with structured logs, traces, and per-step latency metrics tells you exactly where it failed and why, before the user noticed.",
  "beforeState": "Your agent failed last night and you have no idea where in its 12-step workflow it broke. You're rerunning it manually with print statements to find out.",
  "afterState": "The agent emits structured events at every step. You query the trace, see the exact failure, and ship a fix in minutes instead of hours.",
  "status": "published",
  "author": "tbw-ai",
  "contributors": [],
  "tools": [
    "anthropic-api"
  ],
  "createdAt": "2026-04-12",
  "lastVerifiedAt": "2026-04-12",
  "freshnessWindowDays": 90
}
